{
  "$schema": "https://json-schema.org/draft/2020-12/schema",
  "$id": "https://cumcm.local/contracts/literature-source.schema.json",
  "type": "object",
  "additionalProperties": false,
  "required": [
    "schema_version", "source_id", "title", "authors", "year",
    "venue_or_repository", "identifiers", "canonical_url", "retrieved_at",
    "retrieval_backend", "verification_status", "artifact_ids", "content_sha256"
  ],
  "properties": {
    "schema_version": {"const": "1.0"},
    "source_id": {"type": "string", "pattern": "^src_[a-z0-9][a-z0-9_-]{2,63}(?![\\s\\S])"},
    "title": {"type": "string", "minLength": 1},
    "authors": {"type": "array", "minItems": 1, "items": {"type": "string", "minLength": 1}},
    "year": {"type": "integer", "minimum": 1800, "maximum": 2100},
    "venue_or_repository": {"type": "string", "minLength": 1},
    "identifiers": {
      "type": "object",
      "additionalProperties": false,
      "properties": {
        "doi": {"type": "string", "minLength": 1},
        "arxiv_id": {"type": "string", "minLength": 1},
        "pmid": {"type": "string", "minLength": 1}
      }
    },
    "canonical_url": {
      "oneOf": [
        {"type": "string", "format": "cumcm-http-url"},
        {"type": "null"}
      ]
    },
    "retrieved_at": {"type": "string", "format": "date-time"},
    "retrieval_backend": {"enum": ["paper-search", "runtime-search", "user-provided"]},
    "verification_status": {"enum": ["candidate", "approved", "rejected"]},
    "artifact_ids": {
      "type": "array", "uniqueItems": true,
      "items": {"type": "string", "pattern": "^art_[a-z0-9][a-z0-9_-]{2,63}(?![\\s\\S])"}
    },
    "content_sha256": {
      "oneOf": [
        {"type": "string", "pattern": "^[a-f0-9]{64}(?![\\s\\S])"},
        {"type": "null"}
      ]
    },
    "decision_id": {"type": "string", "pattern": "^dec_[a-z0-9][a-z0-9_-]{2,63}(?![\\s\\S])"}
  },
  "allOf": [
    {
      "if": {
        "properties": {
          "retrieval_backend": {"enum": ["paper-search", "runtime-search"]}
        },
        "required": ["retrieval_backend"]
      },
      "then": {
        "properties": {
          "canonical_url": {"type": "string"}
        }
      }
    },
    {
      "if": {
        "properties": {"verification_status": {"const": "approved"}},
        "required": ["verification_status"]
      },
      "then": {
        "required": ["decision_id"],
        "properties": {
          "artifact_ids": {"minItems": 1},
          "content_sha256": {"type": "string"}
        }
      }
    }
  ]
}
